finishId,startId,finishText,vkId,isBest,avgVote,medVote
3289,504,"Когда ругают на планерке, а потом поздравляют с днем рождения",157543481,0,6.35714,5.0
3290,504,",когда разыгрывают не тебя",204000969,0,5.68,5.0
3291,504,Мажем унитаз зубной пастой. Теперь даже если человек включит свет придется стирать) ,375304307,0,3.78571,1.0
3292,503,Это Спарта!,2204686,0,5.75,3.0
3293,505,есть буква Хер,8025376,0,3.55556,3.0
3294,505,В значит вагинальный кандидоз,30033860,1,6.88889,6.5
3295,505,дают скидку за ебало кирпичом.,30033860,0,5.77778,5.0
3296,505,из сырков только подзалупные.,30033860,0,6.88889,6.5
3297,505,"продукты только марки ""каждый день""",8025376,0,3.55556,3.0
3298,505,"продают сперму в батончиках. Для тебя, пидор",8025376,0,2.66667,1.0
3299,505,Носки идут комплекте со сланцами,58598079,0,6.22222,5.0
3300,505,в очереди принято сидеть на бутылке,8025376,0,4.11111,3.0
3301,505,в отделе овощей тебя нашли родители.,30033860,0,7.44444,6.5
3302,505,Русский рэп продают по акции,58598079,0,5.22222,5.0
3303,505,просрочилось моё чувство юмора.,30033860,0,6.33333,4.0
3304,505,тебя не возьмут даже охранником.,30033860,0,4.77778,3.0
3305,505,все равно есть чебупели.,30033860,1,8.11111,6.5
3306,505,в бакалее есть целый стеллаж с битами Славы Мерлоу.,30033860,0,5.44444,4.0
3307,505,Азбука плохого вкуса,574648206,0,1.88889,1.0
3308,506,он первый раз подвёл меня,23504528,0,3.11111,2.0
3309,506,", американцы все равно верят в бога, а не в высадку на луну",8025376,1,4.11111,3.0
3310,506,"а Давыдова, мы про тебя совсем забыли.",54396,1,4.22222,3.0
3311,507,"Смотреть испанские сериалы - стыдно, но интересно",58598079,1,6.375,4.0
3312,507,притча о двух стульях,119657457,0,4.25,3.0
3313,507,сыграть в русскую рулетку с директором и револьвером,119657457,0,3.125,3.0
3314,508,"Не девятая неделя, а девять дней.",23504528,0,3.11111,2.0
3315,508,студенты подолгу сидят на химии,23504528,1,6.11111,6.5
3316,508,сидят на пара́х опиума,8025376,0,4.66667,3.0
3317,508,приход препода никак не влияет на студентов,2204686,1,7.55556,6.5
3318,509,дрочу на собственные фантазии.,30033860,1,6.45455,4.0
3319,510,"мимо меня, пока я дрочил на летние фантазии",119657457,1,5.22222,5.0
3320,510,", а другая половина без ног осталась",119657457,0,3.55556,1.0
3321,510,", пройдет и следующая перед тем, как я открою свой жир солнцу и миру",119657457,0,5.11111,4.0
3322,510,А я все так же дрочу на собственные фантазии,2053953,0,4.77778,3.0
3323,510,", а я всё ещё дрочу на собственные фантазии",11420264,1,5.33333,3.0
3324,511,А ты всё ещё пидр,58598079,0,0.0,0.0
3325,511,"бля я передумал, не могу остановиться",30033860,0,1.66667,1.0
3326,511,На все фантазии подрочено.,8025376,0,0.0,0.0
3327,511,", ну прошел и прошел.",30033860,0,5.16667,3.0
3328,511,". Скорее даже год просидел, а не прошел.",30033860,0,4.27273,3.0
3329,512,"себя со скалы, у Арии выйдет ещё один альбом",8025376,0,4.33333,3.0
3330,512,"Деду на лечение, то отпустит всех",58598079,0,5.0,4.0
3331,512,"Оковы патриархата, можно будет не идти в армию",58598079,1,6.66667,4.0
3332,512,"Мяч, то сборная России заиграет",58598079,0,3.0,3.0
3333,512,"Попить, то лето не закончится",58598079,1,6.33333,5.5
3334,512,"дикпик в воду, соберется аквадикпикотека.",30033860,0,4.66667,4.0
3335,512,"один килограмм, жить станет легче",18486664,0,5.66667,5.5
3336,512,"по паре кило, и отдаст их твоей матери, никто не заметит разницы.",30033860,0,6.0,4.0
3337,512,"по рублю, на квартиру в Москве всё равно не хватит.",30033860,0,5.5,4.0
3338,512,"Если каждый человек скинет мне номер карты, я скажу спасибо",160958633,0,2.66667,3.0
3339,513,"тебя, пидор",8025376,1,3.36364,3.0
3340,513,"писать стоя, что никогда не сидел в библиотеке - слишком мокро.",30033860,1,4.09091,3.0
3341,514,", может ты мудак",58598079,1,7.0,5.5
3342,514,То ты мудак,296536252,0,5.88889,4.0
3343,515,бросил квасить по пятницам,8025376,0,5.33333,5.0
3344,515,- стандартная курсовая в РУДН,8025376,1,6.14286,6.5
3345,515, - любит квасить,2204686,0,3.0,3.0
3346,515,Действует не хуже огуречного рассола из паука,56109258,0,5.57143,4.0
3347,515,Застрял в усах Пескова,16549921,0,5.14286,4.0
3348,515,Придумывает эти заходы,16549921,0,5.14286,4.0
3349,516,всегда подходит к вам боком,2053953,1,6.0,5.0
3350,516,"не успел переписать номер угонщика, состоящий из птички, глазика и совы",2053953,0,5.25,5.0
3351,516,берет взятки котиками,8025376,0,4.75,4.0
3352,517,Владимира Соловьева началась после первой правдивой новости,58598079,0,4.55556,3.0
3353,517,- на средства от аллергии,2204686,0,3.88889,2.0
3354,517,"на шаурму развилась у жителей Питера, бедняги принимают плацебо в виде Шавермы",58598079,1,4.875,4.0
3386,518,Сколько шовинистов нужно чтобы придумать нормальный зачин?,30033860,0,3.57143,2.0
3387,518,"Электрик был очень сильно удивлен, когда приехал по вызову.",119657457,1,5.0,5.0
3388,519,Этим кувшином был Альберт Эйнштейн,8025376,0,3.875,2.0
3389,519,Омлет был с мясом.,54396,1,4.125,4.0
3390,519,"и обосрались - какао какао, као ко кооо!",296536252,0,3.25,3.0
3391,520,и две девушки,8025376,1,4.28571,1.0
3392,520,", когда золотой дождь - пройденный этап",58598079,1,3.28571,3.0
3393,521,фидбэк,296536252,1,7.5,8.0
3394,521,обнулить переменые,8025376,0,3.83333,3.0
3395,521,отправить его на облако,8025376,0,6.16667,6.5
3396,522,"девственность. Оказалось, я её и не терял.",54396,1,9.125,8.0
3397,522,хорошие шутки в шуткоботе. Тщетно.,54396,0,5.875,6.5
3398,522,Себя в школе: не нашёл )))),147427808,0,4.25,3.0
3399,522,"Где у твоей мамаши зад, а где перед",182496323,0,6.875,5.0
3400,522,новых подписчиков в шуткобот. Так я потерял очень много друзей(,8025376,0,7.0,6.5
3401,523,"Лежит в груде других ключей, и искать его 1000 лет",147427808,0,5.44444,4.0
3402,523,потерялся где-то в раздевалке.,30033860,1,6.44444,5.0
3403,504,Это розыгрыш от вожатого,375304307,0,4.30769,3.0
3404,524,Узнать их все сложнее чем стать новым президентом России,58598079,0,5.4,4.0
3405,524,"Одна из них в яйце, яйцо в утке, утка в зайце, заяц в....",58598079,1,6.4,5.0
3406,524,А у тебя только боль в жопе,58598079,0,4.83333,4.0
3407,524,"Это 7 красных перпендикулярных линий, из которых две зеленые и еще две прозрачные, одна линия в форме котенка",229385601,1,7.6,5.0
3408,524,6 из них находиться в кошельке у мужчины,229385601,0,4.9,3.0
3409,524,на каждый из дней недели,229385601,0,6.54545,5.0
3410,524,"Это единственная зона, в которую мужчина хочет попасть",229385601,0,4.3,3.0
3411,524,но ты пидор,33240554,0,5.1,3.0
3412,524,Поэтому мужчины в среднем знают в 7 раз больше.,2204686,0,5.2,5.0
3413,524,"Так, ну и какая третья??",8025376,0,5.41667,5.0
3414,524,"вот они слева направо: Намджун, Чонгук, Чингачгук, Гойко Митич. Люблю вас.",30033860,0,6.3,4.0
3415,524,"3 глаза, 2 уха, 1 рот и 1 зад.",30033860,0,3.36364,3.0
3416,524,Но любимый муж способен довести до оргазма только одну.,30033860,0,4.6,3.0
3417,524,А у мужчины одна.,30033860,0,4.9,3.0
3418,524,"Но, когда она говорит: ""Я люблю тебя"", это значит, что ей в жопу затолкали 7 батареек АА.",30033860,0,2.81818,1.0
3419,524,"но она не знает о них...
Так и живем.",30033860,0,5.0,3.0
3420,524,Но мужу больше нравится в п*зде.,30033860,0,3.18182,2.0
3421,524,Все они находятся на расстоянии метра от её половых органов.,30033860,0,4.3,3.0
3422,524,Но самая чувствительная из них - её парень.,30033860,0,4.54545,4.0
3423,524,две из них пиздец какие смешные.,30033860,0,5.23077,4.0
3424,524,"1. Волосы на груди, 2. Волосы на животе, 3. Волосы на спине, 4. Волосы на ногах, 5. Волосы на лобке, 6.",8025376,0,3.63636,2.0
3425,524,Выпьешь – и у каждой своя!,8025376,0,5.7,4.0
3426,524,А у мальчиков всего одна - память(,8025376,0,4.16667,3.0
3427,524,"А у мужчин? 
— У мужчин тоже. 
Только не надо путать эрогенную зону и очко.",8025376,0,2.8,3.0
3428,526,"чем на то, что твоя мама похудеет.",30033860,0,4.78571,4.0
3429,526,еще один будильник.,30033860,0,5.4,5.0
3430,526,", чем на Спартак.",54396,0,5.8,5.0
3431,526,", чем на сборную России по футболу",2204686,1,6.2,6.5
3432,526,", чем положить на него",2204686,0,5.46667,4.0
3433,525,Идёт на детскую площадку,425878334,1,5.0,3.0
3434,525,Параноик руки,425878334,0,1.15385,1.0
3435,525,Таланта,425878334,0,1.0,1.0
3436,525,отпускает грехи совершенные в пятницу вечером.,30033860,0,4.38462,3.0
3437,527,шутки скоро будут,0,0,0.0,0.0
3438,528,- за нее можно попробовать проголосовать,0,0,0.0,0.0
3439,529,ебуся с эврибади,2573282,0,2.42857,1.0
3440,529,ебуся с эврибади,2573282,0,3.0,3.0
3441,529,",как и мой член, в помаде",2573282,0,3.5,2.0
3442,529,",как и мой член, в помаде",2573282,0,3.25,1.0
3443,529,Плутон,119657457,0,4.28571,2.0
3444,529,Юпитер. Жирен и Красив),119657457,0,3.75,3.0
3445,529,ебуся с эврибади,2573282,0,1.57143,1.0
3446,529,в Коловрате,182496323,0,3.25,3.0
3447,529,",как и мой член, в помаде",2573282,0,2.77778,1.0
3448,529,"Меркурий в Петрограде, Венера в Ленинграде, а я в Ретрограде",229385601,0,5.375,3.0
3449,529,Думала сова,229385601,0,4.25,1.0
3450,529,в Хакамаде. Выборная карусель теперь и в тиндере,8025376,0,3.625,3.0
3451,529,на самоизоляции ((,8025376,0,4.0,4.0
3452,529,"Марс, а ты пидарас",8025376,0,6.125,6.5
3453,529,"Нептун, пустил шептун",8025376,0,5.5,4.0
3454,529,енот Геннадий.,30033860,1,7.71429,6.5
3455,529,у твоей мамки сзади.,30033860,1,6.625,8.0
3456,529,в заде.,296536252,0,3.28571,1.0
3457,529,в губной помаде,296536252,0,6.75,5.0
3458,529,в шоколаде,296536252,0,4.0,4.0
3459,529,на ржавой Ладе,296536252,0,5.85714,5.0
3460,529,в ахуе,33240554,0,6.625,5.5
3461,529,в Винограде,11420264,0,5.0,2.0
3462,529,Томат - солнцу рад,23504528,0,5.5,4.0
3463,530,нужно не быть депутатом,229385601,0,3.18182,2.0
3464,530,нужны Яблоки,8025376,0,4.72727,4.0
3465,530,нужно его распилить,8025376,0,3.7,3.0
3466,530,Ему необходимо перестать быть депутатом,574648206,0,2.6,3.0
3467,530,"он должен быть толстым. Но не каждый толстый может быть худым. Вернее, не только лишь толстый, не каждый может это делать.",296536252,0,4.54545,4.0
3468,530,"мы должны предотвратить аннексию жира, чтобы не разжигать межтканевую вражду.",296536252,0,4.36364,3.0
3469,530,нужно его посадить,5197119,0,3.54545,3.0
3470,530,нужно изменить точку отсчета на весах,5197119,0,3.22222,3.0
3471,530,нужно смотреть на него сквозь пальцы,5197119,1,6.09091,5.0
3472,531,Одни искали других,229385601,0,4.57143,4.0
3473,531,Экспоненты одержали техническую победу,2053953,0,3.85714,3.0
3474,531,Интроверты сражались более героично. Они очень не хотели никого пускать в свой бункер,229385601,0,5.14286,5.0
3475,531,Победили татары. Просто. Потому. Что.,229385601,0,3.71429,3.0
3476,531,Интроверты воевали только с глушителями. А то слишком шумно!!,229385601,0,5.57143,5.0
3477,531,Интроверты старались избегать групповых сражений,229385601,0,5.14286,5.0
3478,531,"первые будут идти в атаку, а вторые - прятаться подальше, делая вид, что они в засаде",2204686,0,3.66667,4.0
3479,531,Интроверты экстравертели экстравертов,18104492,1,7.14286,6.5
3480,531,воюют только на вертолетах,30033860,0,4.85714,3.0
3481,532,Сквирт шот,18104492,1,4.66667,3.0
3482,532,Dust 2,18104492,0,3.44444,3.0
3483,533,— билет на терапию,33240554,0,2.66667,3.0
3484,533,вкусные,33240554,0,3.2,2.0
3485,533,зачем?,33240554,0,1.33333,1.0
3486,533,"скелеты в гробах 2, люди без скелетов, люди против скелетов, скелет и новая мессИя, скелеты против зомби, скелеты и Грааль Путина, скелеты на каникулах, СКЕЛЕТЫ 5",296536252,0,5.6,3.0
3487,533,- так что на всех в баре тряпок и швабр не напасешься,182496323,0,3.0,3.0
3488,533,. Фантастические твари и где они обитают.,54396,0,5.85714,5.0
3489,533,"– и я хочу, чтобы мы все были скелетами в банке!",30033860,0,5.0,3.0
3490,533,"Выпьем за то, что бы скелеты в нашей жизни занимали как можно меньше места!",30033860,0,4.16667,4.0
3491,533,"Это я к тому, что с каждым годом все меньше и меньше скелетов остается в шкафах...",30033860,0,5.0,3.0
3492,533,"- проект о том, что не всегда скелеты — это скелеты, а шкафы — шкафы.",30033860,0,6.0,4.0
3493,533,"... Я думаю, что лучше быть скелетом в шкафу, чем в гробу.",30033860,0,4.66667,3.0
3494,533,"Хороший зачин, у него есть определенный ""костяк""",30033860,1,6.66667,6.5
3495,533,"- «У меня зазвонил телефон, кто говорит? Скелетон!». (олды поймут)",296536252,0,4.0,3.0
3496,534,квас - ты пидарас,8025376,1,8.75,9.0
3497,534,Максончика - за закусончиком,296536252,0,6.625,5.0
3498,535,Не будь некрасивым и неуспешным,229385601,0,5.83333,4.0
3499,535,шути в шуткоботе каждый день,229385601,0,7.0,5.0
3500,535,сьешь бабушкин кобачек,229385601,0,2.14286,2.0
3501,535,нужно родиться татарином,229385601,0,5.57143,3.0
3502,535,то хоти и дальше,229385601,0,5.33333,4.0
3503,535,Не иди работать в государственную школу,147427808,0,4.42857,3.0
3504,535,тяпни пивка для рывка,8025376,0,5.33333,4.0
3505,535,не становись админом шуткобота.,30033860,0,6.33333,5.5
3506,535,нужен простой советский...,30033860,0,5.0,3.0
3507,535,исключи эти ПЯТЬ ПРОДУКТОВ ПИТАНИЯ...,30033860,0,5.83333,4.0
3508,535,"бухай, чтобы забыть о том что ты это хочешь.",30033860,1,7.57143,8.0
3509,535,не сиди так долго в соц сетях,5197119,0,2.0,2.0
3510,535,будть красив и успешен,5197119,0,3.5,3.0
3511,535,"но при этом ты девушка, то смени пол",5197119,0,4.0,4.0
3512,535,"будь или не будь, сделай же для этого что-нибудь",5197119,0,4.71429,3.0
3513,536,нужно уметь выговаривать «президент хуесос» с дубинкой во рту,114330168,1,6.125,8.0
3514,536,", а то ни один журналист не может выговорить мое имя - так прокомментировал ситуацию президент Гурбангулы Бердымухамедов",8025376,0,5.5,5.0
3515,536,",а то товарищи майоры не понимают, есть в песнях современных рэперов экстремизм или нет",8025376,1,6.75,6.5
3516,536,"и педологов, чтобы правильно говорить о почвах.",30033860,0,2.77778,3.0
3517,536,"и велосипедов. Станет проще со скороговорками. Ехала Саша по шоссе, а потом её сбили нахуй.",30033860,0,3.88889,3.0
3518,536,", сказал иностранец, прослушав топ российских треков.",18486664,0,4.375,5.0
3519,536,Логопедов много не бывает.,18486664,0,2.5,2.0
3520,537,гранильщик наук,54396,1,3.28571,1.0
3521,538,Полно чарующих кавказских мотивов,18104492,1,4.57143,3.0
3522,538,стекло и бетон.,18486664,0,3.28571,3.0
3523,538,"стук, как в вагоне метро",18486664,0,3.0,3.0
3524,538,"много заболеваний, потому что переплетения сосудов повторяют московские дорожные развязки",18486664,0,3.28571,3.0
3525,539,даёт домашку,8025376,0,4.2,2.0
3526,539,пизды,296536252,1,6.4,5.0
3527,540,забыл дома ещё и домашку,8025376,1,5.88889,5.0
3528,540,хую не хозяин,296536252,0,4.125,3.0
3529,540,", а наездница без сисек",296536252,0,5.625,5.0
3530,540,", но зато с головкой",296536252,0,4.125,3.0
3531,541,и получил залупу,23504528,0,3.75,3.0
3532,541,И проехал на тракторе до чукотки,23504528,0,2.71429,3.0
3533,541,И мигрировал в Израиль,23504528,0,4.14286,3.0
3534,541,Павел,2204686,0,3.14286,2.0
3535,541,- Петр поросенок,2204686,0,3.42857,3.0
3536,541,цех и стал первым свиным мармеладом,2204686,1,6.375,8.0
3537,542,от бабушек называется бабуллинг,8025376,1,6.5,5.0
3538,542,от поваров - бублинг,8025376,0,5.33333,5.0
3539,542,от дайверов - бульбуллинг,8025376,0,5.16667,5.0
3540,542,"от учителей называется ""урок""",8025376,0,5.0,5.0
3541,543,четверг - чистый.,8025376,0,3.4,3.0
3542,543,суббота - расплатница(,8025376,1,6.0,5.5
3543,543,втомобиль,229385601,0,4.4,4.0
3544,543,мать твоя говнолопатница.,30033860,0,2.2,1.0
3545,544,и другие честные вакансии ищите на Хэд Хантере,2053953,1,5.6,5.0
3546,544,запустил вместо контекстной рекламы - наскальную,2053953,1,6.8,5.0
3547,544,придумал этот зачин.,54396,0,4.6,3.0
3548,545,кто-то умер. Не велика потеря.,54396,1,7.25,8.0
3549,545,живёт твой член,8025376,0,4.125,4.0
3550,545,"зарплаты больше, чем в России",8025376,0,5.25,5.0
3551,545,Даже твой писюн большой,18104492,0,4.75,4.0
3552,546,"вибраторов, то машины заебут человечество насмерть",11420264,0,6.125,4.0
3553,546,"утра, то всё так и закончится в пробке.",11420264,0,6.0,5.0
3554,546,"понедельника, то я успею начать новую жизнь",11420264,1,8.33333,9.0
3555,546,,11420264,0,1.57143,1.0
3556,546,"Яндекса, то найдётся всё.",11420264,1,8.66667,9.0
3557,546,"Билайна, то теперь они на нашей стороне",11420264,0,7.57143,6.5
3558,546,"Востока, то хуй знает, но знает Ху Й",11420264,0,4.33333,3.0
3559,546,,11420264,0,2.0,1.0
3560,546,"Электронного голосования, то можно выиграть квартиру, но лучше не надо",11420264,0,5.42857,4.0
3561,546,"Электронного голосования, то его объявят экстремистом",11420264,0,4.16667,4.0
3562,546,"VK, то машины вернут стену",11420264,0,7.5,8.0
3563,546,"2ch, то никто не поверит",11420264,0,4.33333,4.0
3564,546,"Dota 2, то это будет изи катка",11420264,0,6.85714,6.5
3565,546,"Pornhub, то я и не против",11420264,0,5.33333,5.0
3566,546,И чё?,296536252,0,4.0,3.0
3567,546,Ебаные лилипуты,296536252,0,3.5,3.0
3568,547,то крокодил подхватит),8025376,0,4.36364,4.0
3569,547,", значит – остался без обеда.",54396,1,5.36364,5.0
3570,547,то че бля за аист,160958633,0,4.72727,3.0
3571,547,гос бухгалтерия все исправит,160958633,0,2.63636,3.0
3572,547,то я теперь понимаю почему половина детей не по адресу,160958633,1,5.45455,3.0
3573,548,гостей не было. Боятся стоматологов.,54396,0,5.0,4.0
3574,548,все сидели широко раскрыв рты,8025376,0,4.42857,3.0
3575,548,все дарили молодоженам самое дорогое - свои улыбки,8025376,0,4.28571,4.0
3576,548,9 из 10 стоматологов одобрили его выбор,8025376,1,5.42857,4.0
3577,548,дарёному коню в зубы не смотрят,56109258,1,5.42857,5.0
3578,549,Вечные,8025376,0,4.88889,5.0
3579,549,Скрепы,296536252,0,4.88889,3.0
3580,549,Novi Choke,11420264,1,6.22222,6.5
3581,549,Со вкусом краба,18104492,0,4.55556,4.0
3582,550,строит простые пирамиды,8025376,1,3.875,3.0
3583,551,и другие последствия антисанитарии в крестьянской среде,2204686,0,3.81818,3.0
3584,551,"... От него заяц ушёл, волк ушёл, медведь ушёл. А лису всё-таки зацепило...",2204686,1,5.08333,4.0
3585,551,"- просто обосраться, какой смешной зачин!",2204686,0,4.27273,4.0
3586,551,вышел на геосинхронную орбиту,8025376,0,2.81818,3.0
3587,551,Обосрался,18104492,0,2.27273,1.0
3588,552,питаются лучше волков мусульман,2053953,1,4.4,3.0
3589,552,"любят ходить на причастие, потому что там дают кровь и тело христово",8025376,0,3.13333,3.0
3590,553,Хочешь шутку,521917926,0,1.6,1.0
3591,553,Жил был и не стало,521917926,0,2.45455,1.0
