finishId,startId,finishText,vkId,isBest,avgVote,medVote
2016,306,Когда дети делают всё сами и без помощи вожатого,375304307,0,6.92593,5.0
2017,306,"Привезти столько же детей, сколько увёз(ни меньше, не больше!)",31466566,1,9.75862,10.5
2018,306,- Премия,31466566,0,6.86207,5.0
2019,306,- Выходной,31466566,0,6.61538,5.0
2020,317,вместо капусты родители рассказывали ему про непорочное зачатие,2204686,1,6.0,5.0
2021,317,не было сигарет. Вот Мария и придумала непорочное зачатие.,59375035,0,3.16667,3.0
2022,317,", кто ему делал обрезание?",59375035,0,3.53846,3.0
2023,317,", маман первой признала профит от его хождения за водой)",59375035,0,4.41667,4.0
2024,317,какой год он видел на календаре?,54396,0,5.5,5.0
2025,306,- это один и тот же зачин два раза подряд:),2204686,0,5.60714,5.0
2026,318," рано вставать и учиться, учиться, учиться!)",59375035,0,4.22222,4.0
2027,318,валюту и перевороты по утрам.,59375035,0,3.66667,3.0
2028,318,рабочий класс и по этому ушёл в вожди.,59375035,0,4.11111,3.0
2029,318,"красный цвет, а как ещё привить эту любовь большинству?)",59375035,0,3.77778,3.0
2030,318,,8025376,0,2.55556,1.0
2031,318,"постоянно повторять: ""Вы - худший класс, с которым я работал""",8025376,1,6.33333,8.0
2032,275,"сейчас в кафе, потому что проникновение в чужое закрытое помещение - наказуемо",2204686,0,7.0,5.0
2033,323,храпом пьяного бати.,59375035,0,2.8,3.0
2034,323,"тем, как надо мной издевались в школе.",59375035,0,4.1,3.0
2035,323,твоей бывшей),59375035,1,5.4,5.0
2036,323,твоей жизнью.,59375035,0,5.9,5.0
2037,323,кератином,2204686,0,3.3,3.0
2038,323,коронами на голове у некоторых правительственных вирусов,2204686,0,4.2,3.0
2039,323,"полным пиздецом, но последнее время стремится ему соответствовать",2204686,0,4.3,4.0
2040,323,"ожидаемым будущим, год-то ещё не кончился.",59375035,1,6.09091,5.0
2041,323,необходимостью его с чем-то сравнивать,2204686,0,4.2,3.0
2042,323,тремя годами на подводной лодке,201608425,0,5.6,5.0
2043,323,с ценой места на кладбище,201608425,0,5.90909,5.0
2044,307,да мы правда к девочкам в комнату за чайным пакетиком идем,232668477,1,8.63636,8.0
2045,307,"Это дело рук вожатых, он ничего не трогал",375304307,0,6.38235,5.0
2046,324,и взяла палку - тогда же появился налог на самозанятых,8025376,0,5.71429,4.0
2047,324,- она облысела от стресса,8025376,0,4.42857,4.0
2048,324,", она сказала: ""Ух-ты, а русский реп и правда говно""",8025376,0,5.57143,4.0
2049,324,", сразу пришлось занимать работой других ""обезьян"".",59375035,0,5.0,4.0
2050,324,"всё изменилось, жаль что сейчас многие превращаются в обезьян.",59375035,0,3.0,3.0
2051,324,"не могла и подумать во что это ""выльется"".",59375035,0,4.71429,4.0
2052,324,изменилась только внешность.,59375035,0,5.42857,4.0
2053,324,", до изобретения шуткабота оставалось ещё ооочень долго)",59375035,0,3.71429,3.0
2054,324,", первая мысль: ""Уххх, бляя!!!"")))",59375035,0,5.0,3.0
2055,324,возникло понятие зоофилия,201608425,0,5.14286,4.0
2056,324,тут же потребовала независимость чечни,201608425,1,6.71429,5.0
2057,324,"в небе грянул гром, на горе свистнул рак, а вода потекла под лежачий камень",201608425,0,4.42857,3.0
2058,324,то сразу же пошла таксовать на вокзал.,174364672,0,5.0,5.0
2059,324,"- обезьяной, то она попыталась присоединиться к мстителям и спости мир от таноса.",174364672,0,4.42857,3.0
2060,307,у вожатых самая лучшая работа!,181336457,0,6.82353,5.0
2061,307,вожатые спят на тихом часу,181336457,0,6.26471,5.0
2062,325,Радиоактивная! Теперь я Человек-Панин,8025376,0,2.88889,1.0
2063,325,"Дом-терьер, не могу находиться на улице.",59375035,1,4.11111,3.0
2064,325,Жиртерьер.,59375035,0,3.88889,3.0
2065,325,Нахбернар.,59375035,0,2.44444,1.0
2066,325,"Суля по загноению, бещздомная.",59375035,0,3.44444,1.0
2067,325,Вроде привитая.,59375035,0,2.33333,1.0
2068,325,Баскервилей.,59375035,0,3.22222,1.0
2069,325,Собака-кусака!),59375035,0,3.44444,2.0
2070,325,Кусачая!,2204686,0,2.44444,1.0
2071,325,Мстительная: я укусил её первым.,2204686,0,4.11111,3.0
2072,307,я ребёнок!,2204686,0,4.63636,3.0
2073,307,я вам уже не ребёнок!,2204686,0,8.52941,8.0
2074,319,Я начинаю искать баночку с вазелином,5708650,0,4.95238,4.0
2075,319,любовь к детям пропадает,176161256,0,6.325,5.0
2076,319,выживает сильнейший.,252703075,1,7.675,8.0
2077,319,ноги вожатых уже до планерки не доходят.,252703075,1,8.07317,8.0
2078,319,спать хотят даже дети.,252703075,0,5.67442,3.0
2079,319,"всё что ты делал становится ""косяками""",258492211,0,6.53846,6.5
2080,319,Старший вожатый вызывает скорую помощь на весь вожатский коллектив,400264489,0,5.9,5.0
2081,319,Вожатые прячутся под кроватями детей,400264489,0,5.84615,5.0
2082,319,Все вожатые-атеисты начинают молиться,400264489,0,6.825,6.5
2083,319,все дружно готовятся отхватывать за мвои отряды,232668477,0,4.60526,3.0
2084,319,во всех просыпается кофеиновый монстр,232668477,0,5.48837,4.0
2085,319,сразу хочется превратиться в мышь,95353242,0,5.475,3.0
2086,326,", пьяный батя.",59375035,1,6.0,4.0
2087,326,- школа.,59375035,0,3.45455,3.0
2088,326,"общественный транспорт. Жопы на уровне глаз, ну такое себе.",59375035,0,4.1,4.0
2089,326,поручни и верхние полки.,59375035,0,4.2,3.0
2090,326,отсутствие жизненного роста),59375035,1,5.27273,5.0
2091,326,низкий уровень жизни.,59375035,0,4.72727,3.0
2092,326,это высокие морально-этические нормы.,59375035,0,5.18182,5.0
2093,326,"пенсионеров - маленькие пенисы.

Да, всё так.",30033860,0,5.11111,4.0
2094,319,Вожатый доходит до ручки,175819067,0,5.6,5.0
2095,319,У всех вожатых начинаются огоньки в отряде,375304307,0,5.37209,5.0
2096,327,"""вчера было как-то получше""",18486664,0,6.66667,6.5
2097,327,я просто поем за твой счёт.,18486664,0,4.125,3.0
2098,327,"во время минета, если ты девушка.",54396,0,4.25,4.0
2099,327,и не проси. Сами все предложат и сами все дадут.,5828621,0,6.0,5.0
2100,281,На выходных я предпочитаю ничего не предпочитать,304169274,0,5.75,5.0
2101,327,о лечении в КВД.,59375035,0,5.77778,4.0
2102,327,"о том, что живёшь с мамой.",59375035,0,4.33333,3.0
2103,327,о операции по смене пола.,59375035,0,5.66667,4.0
2104,327,о своей бывшей.,59375035,0,4.0,3.0
2105,327,"о том, как нажрался на выходном.",59375035,0,4.625,4.0
2106,327,о своём гомосексуальном опыте.,59375035,0,4.875,4.0
2107,327,", что её мама сексуальная.",59375035,0,3.5,4.0
2108,327,",что твоя сестра целуется лучше.",59375035,0,7.55556,5.0
2109,327,"слишком много, иначе толку от свидания может быть слишком мало...",2204686,0,5.22222,4.0
2110,327,"о том, где спрятал хабар. Майор куму стучит.",546424498,0,3.125,3.0
2111,327,"ей о том, как сильно она похожа на своего усатого отца",546424498,0,5.5,4.0
2112,327,партнеру о статистике изнасилований на первом свидании с подписчиками Шуткобота,546424498,1,7.66667,8.0
2113,320,Сложное отмывать стены,92013142,0,6.45455,5.0
2114,320,время наконец выучить имена всех детей,142931364,1,9.67647,13.0
2115,320,время сна уже особенно дорого,142931364,0,4.41176,3.0
2116,320,Самое,375304307,0,3.47222,1.0
2117,320,"Время вспомнить, чем запомнилась смена",375304307,0,5.41935,4.0
2118,320,Главное сдать всех детей,190062085,0,6.16667,5.0
2119,320,"Приятное, когда дети забывают забрать свою запрещенку",157543481,0,8.20588,8.0
2120,320,"Грустное, когда не можешь найти покрывало, 2 полотенца и фонарик",157543481,0,8.62857,8.0
2121,320,"Классное - это кричать ""и мы счастливы!""",157543481,0,5.69697,3.0
2122,320,В конце смены самое главное не затопить лагерь слезами,185222786,0,5.71053,3.0
2123,320,В конце смены самое главное не убежать с детьми в лес в королевскую ночь,185222786,0,5.44118,5.0
2124,320,В конце смены самое интересное только начинается!,185222786,0,5.97297,5.0
2125,320,важное не потерять детей,573137232,0,6.02778,5.0
2126,320,худшее заблудиться в плане работы на следующую смену,573137232,0,4.09091,3.0
2127,321,младшим отрядом,232668477,0,6.45455,5.0
2128,321,летом карантинным,369474176,1,7.4375,8.0
2129,321,домашним...,2204686,0,4.69697,3.0
2130,321,дождливым мной,172032981,0,4.46875,3.0
2131,321,дождливой зимой?,369474176,0,5.4375,5.0
2132,321,онлайн-лагерем,369474176,0,7.71875,8.0
2133,328,"""Вернем кокаин в кока-колу""",5828621,0,3.44444,3.0
2134,328,"""Make America Great Britain again""",5828621,1,7.22222,6.5
2135,328,"""Перестанем делать тупых людей знаменитостями!""",5828621,0,3.33333,2.0
2136,321,"тем, что сбылись предсказания буддийских лам о дождливом лете - Информация проверена",375304307,0,4.69697,3.0
2137,321,Отсутствием лета,157543481,0,6.78788,5.0
2138,321,Закрытием ближайшего магазина,157543481,0,6.13793,5.0
2139,321,Планеркой,157543481,0,6.03333,5.0
2140,321,Голодными детьми,314286186,0,5.96875,5.0
2141,321,Непослушными детьми,314286186,0,5.16667,3.0
2142,321,Младшим отрядом,314286186,0,7.12121,6.5
2143,329,"кроссовки, они были бы сухие и хрустящие.",18486664,1,5.2,5.0
2144,329,"мороженое, оно было бы из картошки.",18486664,0,4.6,5.0
2145,321,жарким летом и 1 кепки на весь отряд,213918658,0,7.15152,5.0
2146,321,слезами детей в конце смены,180021391,0,7.90625,8.0
2147,321,"тем, когда уже конец смены, а ты так и не нашёл эти 3 вафельных полотенца и спортинтвентарь. А час расплаты близко.",180021391,1,8.21875,8.0
2148,321,Планёркой в 8 утра,182461514,0,8.13333,8.0
2149,321,С количеством щапрещенки у детей,182461514,0,5.25714,3.0
2150,333,. Подняться по служебной лестнице смогли единицы.,54396,0,5.27273,5.0
2151,333,- социальный,2204686,0,5.66667,5.0
2152,333,"- теперь наверх не проходят не только народные инициативы, но и народные избранники",2204686,0,5.54545,5.0
2153,333,"К сожалению, никто не пострадал",238466338,1,8.2,8.0
2154,333,поэтому теперь социальная мобильность в России перестала быть возможной теперь и физически,137370434,0,3.90909,3.0
2155,332,не будить детей.,185222786,0,6.1,5.0
2156,332,кушать больше 3-х раз в день.,185222786,0,7.64286,8.0
2157,332,Заставить встать каждого ребёнка в строй перед экраном монитора,205832943,0,7.21429,8.0
2158,332,"Дистанционный вожатый может работать и быть активным, но не видеть ИХ",281897755,0,4.375,3.0
2159,332,в трусах и с едой сидеть на каждом мероприятии,281897755,0,7.71429,8.0
2160,332,отправить детям полдник Яндекс.Едой,75839545,0,8.75862,8.0
2161,332,повышать на непослушных детей шрифт,75839545,1,9.62069,10.5
2162,333,ни один думгай не может пройти игру до конца,2534766,0,4.0,3.0
2163,333,... у черного хода. Теперь путаны пыхтят чуточку дольше.,2534766,0,5.2,4.0
2164,332,Но не хочет работать дистанционно,375304307,0,5.81482,5.0
2165,334,медведе - машина.,59375035,0,4.16667,4.0
2166,334,площади какая-то французская дама.,59375035,0,3.28571,3.0
2167,334,придомой территории мусора. В прочем ничего нового.,59375035,0,3.5,3.0
2168,334,деле нет. Ещё ни разу не видел депутата в горящей шапке),59375035,0,7.0,6.5
2169,334,тебе только твой пукан полыхает.,59375035,0,4.66667,4.0
2170,334,"сердцееде тогда что?  Презерватив горит, получается?",59375035,0,2.71429,3.0
2171,334,воре-водолазе?,59375035,0,4.0,4.0
2172,334,Малышевой прокладка.,59375035,0,5.4,4.0
2173,334,"Пахоме - ""сладкий хлеб"")",59375035,0,3.75,3.0
2174,334,кой вору горящая шапка?,59375035,0,6.0,5.5
2175,334,"фига придумывать зачин, если есть богатый запас русских пословиц и поговорок",54396,1,7.33333,8.0
2176,334,нас хо чет ся.,54396,0,2.33333,2.0
2177,335,в анекдот - и анекдот автоматически заходит!,2204686,1,6.33333,6.5
2178,335,"в Автоваз. Русский говорит: ""Вот это машина!"". Немец в ответ: ""Ваз из дас???""",2204686,0,5.14286,3.0
2179,335,"к китайцу и просят по кружке пива ""Корона"". А он им, с..ка, другую корону...",2204686,0,2.42857,2.0
2180,335,в ВОЗ. А ВОЗ и ныне там!,2204686,0,4.71429,3.0
2181,335,в скайп и начинают жаловаться друг другу на карантин...,2204686,0,5.125,4.0
2182,335,"к своему правительству за материальной помощью. И немец начинает праздновать день получки, а русский - День Победы...",2204686,0,6.16667,5.0
2183,335,"в бар, а там большими буквами написано: МЫ ЭТОТ АНЕКДОТ УЖЕ СЛЫШАЛИ!",2204686,0,5.25,5.5
2184,335,"к американцу и говорят: ""Корону нашу не видел?"" - ""Нет"" - ""Ну скоро увидишь!""",2204686,0,3.0,3.0
2185,330,это победа его отряда,205832943,0,5.71429,5.0
2186,330,Когда мальчики уснули не под кроватями в комнате девочек,370241438,1,9.46429,8.0
2187,330,Это когда после королевской ночи ни у кого из детей на лицах не осталось ожогов от пасты,370241438,0,7.03571,6.5
2188,330,Это когда младший отряд сам смог рассесться в столовой,370241438,0,8.6,8.0
2189,330,"Когда на младшем отряде во время завтрака/обеда/ужина и тд, малыши не подбегают с фразой ""а мне места не хватило""",370241438,0,7.28125,6.5
2190,330,Это победа его отряда во всех мероприятиях на смене,375304307,0,6.7931,5.0
2191,330,"наступает не в мае, а в конце августа",2204686,0,8.66667,8.0
2192,330,это проснуться раньше детей на подъёме,573137232,0,8.74194,8.0
2193,330,это не иметь выговоров от старшего вожатого,573137232,0,7.32143,6.5
2194,330,сдать столько же детей сколько принял,258492211,0,8.46667,8.0
2195,330,когда дети отдали свой полдник,258492211,0,8.66667,8.0
2196,330,"когда ставят на тех же любимых детей, что и в прошлом году",258492211,0,7.60714,8.0
2197,330,не уснуть на планёрке,258492211,0,7.72414,8.0
2198,335,в Польшу... А дальше вы и сами все прекрасно знаете :),174364672,0,3.83333,3.0
2199,335,Ну короче с Днём Победы!),174364672,0,3.0,3.0
2200,330,Не уснуть на зарядке,204000969,0,7.03571,5.0
2201,330,Это когда на родительский день из отряда забрали всех детей,204000969,0,9.11111,8.0
2202,322,Появляется и пропадает внезапно,370241438,0,4.47619,3.0
2203,322,очень радует уборщиц,75839545,0,6.77273,5.0
2204,322,не страшен никому,370241438,0,4.17391,3.0
2205,322,помогает вожатым не валить я с ног от недостатка сна,370241438,0,4.75,3.0
2206,322,"это печально, но сны длятся дольше",370241438,0,5.15789,3.0
2207,322,"- отличный повод сделать ремонт в корпусах. Эх, мечты, мечты...",75839545,0,6.15,5.0
2208,322,- ерунда по сравнению с карантином в городе...,2204686,0,4.71429,4.0
2209,322,"- время, когда закрыт не только душ, но и всё остальное",75839545,0,6.2,5.0
2210,322,Дело былое,157543481,0,3.75,3.0
2211,322,Лагерь в интернете,157543481,0,4.59091,3.0
2212,322,Карантин в душе,157543481,0,3.57143,3.0
2213,322,Как вирус на компьютере,157543481,0,4.2381,3.0
2214,322,Карантин в лагере - карантин в душЕ,281897755,0,4.15789,3.0
2215,322,Когда в лагере карантин не придётся заставлять детей мыть руки - теперь их заставит жизнь,281897755,0,6.63158,5.0
2216,322,Голосоватт,258492211,0,1.5,1.0
2217,322,"все-таки случился. Ты так и не можешь распознать детей, потому что они все в защитных комбинезонах. Они даже поесть нормально не могут, места просто не хватит через 1,5 метра, поэтому все дружно сушим сухари в подземелье.",95353242,0,5.68182,5.0
2218,337,теперь каждый удар по полицейскому монетизирован! Пополни счет и выходи на митинг подготовленным!,8025376,0,5.41667,4.0
2219,337,апгрейдите себя чип-и-дейлинных - и спешите на помощь!,2204686,0,2.58333,2.0
2220,337," теперь вместо ""пошел на х..."" вы можете использовать свайп влево",2204686,1,5.57143,5.0
2221,337,при перепрошивке загрузите себе адекватную картину мира,2204686,0,4.66667,3.0
2222,281,искать выход,2204686,1,9.0,9.0
2223,281,выход в астрал,2204686,0,3.0,3.0
2224,281," сидеть дома. Получается, карантин для меня как выходные?",2204686,0,4.66667,3.0
2225,281,выходить,2204686,0,8.5,8.0
2226,281,выходить из себя,2204686,0,4.25,4.0
2227,322,это лучше чем лагерь в карантине,369474176,1,7.3,6.5
2228,322,Действует только когда приезжает СЭС,204000969,0,6.27778,5.0
2229,322,Соблюдается до отбоя,204000969,1,6.15,8.0
2230,331,утра,2204686,0,4.06897,3.0
2231,331,жуткого недосыпа,308831820,0,6.2069,5.0
2232,331,"того, что ты просыпаешься вечером",308831820,0,4.96552,3.0
2233,331,лени и охотой чего-нибудь съесть,308831820,0,5.37931,5.0
2234,331,"...ука, опять начинается!",2204686,1,7.35714,8.0
2235,331,"детей, вставших до подъёма",2204686,1,8.4,8.0
2236,331,Отрицания,204000969,0,7.35484,8.0
2237,331,": "" Чур не я бужу детей""",204000969,0,7.5,8.0
2238,331,пяти часов вечера,95353242,0,4.31034,3.0
2239,331,"не с кофе, а когда его начинают будить дети.",375304307,0,6.03571,5.0
2240,283,я вырасту,519037670,0,3.5,4.0
2241,283,я постарею,519037670,0,5.5,4.0
2242,283,?,304169274,0,6.25,8.0
2243,331,"чашечки отборного ""вааажааатыыыеее!""",75839545,0,6.13793,5.0
2244,336,"Что : ""На берегу большой реки какая-то безумная пчела получилась на нос медведя""",204000969,0,4.66667,5.0
2245,336,", что количество его булочек на полднике прямо пропорционально количеству забранных на выходной детей",204000969,1,8.45455,8.0
2246,336,": как отряд не воспитывай, а уголок все равно тебе дорисовывать",204000969,0,8.0,8.0
2247,336,Что в родительский день будет запрещенка,175761648,0,6.42857,8.0
2248,336,Что он лчший,175761648,0,5.40909,5.0
2249,336,И надеется на то что сезон будет,175761648,0,7.89474,8.0
2250,336,во сколько начинается завтрак/обед/ужин,308831820,0,6.7619,5.0
2251,336,что нужно бесконечное количество скотча,308831820,0,7.9,8.0
2252,336,где лежит доширак,308831820,0,7.0,6.5
2253,336,"Знает всех детей в отряде, но забывает как их звать по имени",375304307,0,7.72727,8.0
2254,336," сколько раковин в столовой, чтобы выиграть общелагерный квест",125325904,0,7.95238,8.0
2255,336,"Что резать апельсин в столовой нужно тайком, иначе придется резать ещё 25 раз",125325904,0,7.36364,8.0
2256,336,Где найти пиво в лагере,272636561,0,5.65,3.0
2257,336,Как обмануть поваров и получить халявную порцию на обед,272636561,0,7.52381,8.0
2258,336,1000 и 1 способ избежать встречи с родителями,272636561,0,7.2381,8.0
2259,336,как уговорить ребенка отдать лишнюю булочку,125325904,0,7.3,8.0
2260,336,"через какую дырку  в заборе убегают  дети. 
Потому что сам пользуется той же ",159518321,0,7.91667,8.0
2261,336,"Каждый вожатый знает, что дети обожают не спать по ночам, сколько бы они не устали. Ночью жизнь кипит.",540449707,0,4.14286,3.0
2262,336,1000 и 1 прилагательное на первую букву своего имени,75839545,0,8.22727,8.0
2263,336,", что скотч, сука, опять закончился",75839545,0,8.72222,8.0
