finishId,startId,finishText,vkId,isBest,avgVote,medVote
-1028,-100,скотч,8025376,0,3.5,2.0
-1027,-100,"на себе безногого бомжа Арсения, которого все дружно использовали для игры ""жертва социальной напряженности"".",546424498,0,2.6,2.0
-1026,-100,с собой герпес - командную игру для всех возрастов.,546424498,1,8.1,8.0
-1025,-100,"с собой настолки. Он снова забыл, что физрук - это он.",56109258,0,3.09091,3.0
-1024,-101,что стал плацкарт-комиком,54969569,0,5.63636,3.0
-1023,-99,"детей, и система образования в России стала идеальной",4497215,1,7.0,4.0
-1022,-99,чрезмерно коррумпированного учителя ОБЖ,4497215,0,5.33333,4.0
-1021,-99,"образовательную составляющую. Стало легче, ведь сумасшедшим жить легко",5197119,1,5.33333,4.0
-1020,-98,Собирал у детей деньги за отмену урока,56109258,0,4.0,3.0
-1019,-98,"никогда не будет пойман, потому что знает все запасные выходы",8025376,1,5.83333,6.5
-1018,-98,"заламывает руки тем, кто не сдал на кислород для противогаза",5197119,0,3.33333,3.0
-1017,-98,снимает противогаз с ребенка только после взятки.,5197119,0,3.0,3.0
-1016,-97,"У кого больше пасочка, тот и лидер",5197119,0,3.0,2.0
-1015,-97,По лайкам в инстаграме мамы,5197119,0,4.42857,3.0
-1014,-97,"Посмотри на того, кто с пустыми руками и орет на других",5197119,0,3.14286,2.0
-1013,-97,он разносит все куличики,4497215,0,2.14286,1.0
-1012,-97,все кроме него - жуют песок,4497215,0,2.42857,1.0
-1011,-97,его не видно,4497215,0,2.85714,1.0
-1010,-97,"сначала он ест песок, а потом уже все остальные",8025376,1,6.28571,5.0
-1009,-94,"застрял в твоей жопе, пидор",8025376,0,2.75,1.0
-1008,-94,"теперь колет не лед, а героин",8025376,0,2.75,1.0
-1007,-94,"простите, очень сложный зачин, не смогу придумать шутку(",8025376,0,1.0,1.0
-1006,-94,"Даааа, именно он мне запомнился в фильме «Основной инстинкт»",56109258,1,3.75,3.0
-1005,-94,я забыл отмыть и получил ремня от мамки,546424498,0,2.0,2.0
-1004,-94,разледил кол.,191586127,1,3.0,3.0
-1003,-95,". Видимо, он тоже подписан на Шуткобот",8025376,0,6.28571,4.0
-1002,-95,". Кажется, я приёмный...",191586127,0,5.0,4.0
-1001,-95,. Они оказались мужские. Вот оно что значит: «не то что в наше время...»,56109258,0,4.71429,4.0
-1000,-95,", а у мамы его мужские трусы. Посмотрела на аиста над кроватью и лёг спать.",56109258,0,5.14286,3.0
-999,-95,Мой дед такой растеряшка,54969569,0,6.42857,4.5
-998,-95,А отец у меня нет,54969569,1,7.42857,5.5
-997,-96,"И тех, и других можно найти на Pornhub",546424498,0,6.33333,6.5
-996,-96,Их удобно перевозить в грузовике,546424498,0,7.33333,8.0
-995,-96,"Они не сопротивляются, когда ты сверху",546424498,0,6.83333,6.5
-994,-96,Они оба раскладываются,5197119,0,4.16667,1.0
-993,-96,"Это такие же единые понятия, как ""ты"" и ""пидор""",8025376,0,4.16667,1.0
-992,-96,в основном они видят только жопы,8025376,1,8.5,10.5
-991,-96,На нем спит собака,54969569,0,3.16667,2.0
-990,-96,У обоих ножки короткие,18486664,1,9.4,9.0
-989,-96,Короткие ножки,54969569,0,8.0,5.5
-988,-93,", а герпес - от любовницы",8025376,1,4.66667,4.0
-987,-93,ты пидор,8025376,0,4.0,1.0
-986,-93,": ""я на что-то нажала, но ничего не случилось"". Как хорошо когда поставил систему защиты от детей",5197119,0,3.53333,3.0
-985,-93,", как гром среди ясного неба...если она рядом спит",5197119,0,3.13333,3.0
-984,-92,- в пятницу 13го в 13:13 выехать на работу к 9. Пьяным.,2204686,0,5.0,4.0
-983,-92,"- это если назвал кошку ""Примета"", а она все время гадит везде",2204686,0,4.0,4.0
-982,-92,"- случайно отправить добивку ""ты пидор"" вместо Шуткобота начальнику",2204686,0,5.08333,5.0
-981,-92,- лишать гаишника 13й зарплаты в нетрезвом состоянии,2204686,0,4.16667,3.0
-980,-92,- писать бывшей с телефона нынешней,2204686,0,6.25,6.5
-979,-92,", если падает нож на пол - придёт мужчина. Но сколько бы ножей не уронила Оля в пятничный вечер, так никто и не пришёл...",56109258,0,5.1,5.0
-978,-92,"увидеть светлячка, если ты работаешь в АЭС",34957710,1,6.58333,6.5
-977,-92,гладить хача против роста шерсти,34957710,1,6.5,8.0
-976,-91,", то крики родителей о тупом сыне станут на 50% тише",64627775,1,8.0,8.0
-975,-91,", то через некоторое время можно услышать голос психиатра",2204686,0,5.5,5.0
-974,-91,"на Красной площади, то можно услышать, как к тебе подойдёт сотрудник ФСО в штатском",2204686,0,3.875,3.0
-973,-91,"на Красной площади, то потом, возможно, придётся долго сидеть",2204686,0,5.42857,5.0
-972,-91,"в людном месте, то можно прослыть современным художником",2204686,0,5.0,5.0
-971,-91,", потом встать и присмотреться, затем снова лечь и прислушаться и т.д. - получится неплохая зарядка",2204686,0,4.875,5.0
-970,-91,"на МКАДе получилось раньше, чем тебя сбили - значит сейчас пробки",2204686,0,3.0,3.0
-969,-91,"- то можно услышать, как подъедет машина, которая тебя задавит",2204686,0,3.5,3.0
-968,-91,", то про тебя потом могут пошутить в Шуткоботе",2204686,0,4.0,3.0
-967,-91,Можешь услышать стоны кротихи,80391772,0,4.75,5.0
-966,-90,"России с Белоруссией найден Панин. Но задержать его невозможно. Одна нога здесь, другая - там",34957710,0,3.875,3.0
-965,-90,сломался ключ. Пополам. :/,18486664,0,2.25,2.0
-964,-90,": 
- Пути.
- Не путю!",18486664,0,4.875,4.0
-963,-90,реальности и фантастики можно встретить хорошие шутки в Шуткоботе,2204686,1,6.125,5.5
-962,-89,рабочие не делятся,2204686,0,3.71429,3.0
-961,-89,силы обычно не кончаются,2204686,0,3.0,3.0
-960,-89,все только начинается,2204686,0,3.42857,3.0
-959,-89,"хорошо, когда пятница, а у меня, $#@, воскресенье",2204686,0,2.55556,2.0
-958,-89,...В каком конце? Спросил Владимир Владимирович,56109258,0,3.125,3.0
-957,-89,"тракторист Петрович урчит, как кот",5197119,0,3.5,3.0
-956,-89,рабы на галерах уходили на заслуженный отдых на плантации,5197119,0,3.71429,3.0
-955,-89,у некоторых начинается следующая рабочая неделя,5197119,0,2.77778,2.0
-954,-89,"летом можно увидеть свое начальство, если быть очень внимательным.",18486664,1,4.88889,4.0
-953,-89,мы уже какие-то нерабочие,229385601,0,4.5,3.0
-952,-89,начининается новая,229385601,0,2.75,3.0
-951,-88,"бабушки, они и так пухленькие, решила мама и сама поехала к бабушке.",56109258,0,4.5,5.0
-950,-88,"сладкого, сказал папа и съел весь торт.",56109258,0,7.0,7.0
-949,-88,"0 до 18 лет, потом они уже не дети",2204686,0,3.6,2.0
-948,-88,заката до рассвета,2204686,0,5.0,3.0
-947,-88,лично. От лично министра образования с её нововведениями,2204686,0,4.5,5.0
-946,-88,"информации 18+, потому что иначе они поймут, какая х*йня творится во взрослой жизни и откажутся взрослеть",2204686,0,6.4,6.5
-945,-88,"коррупции, поэтому я здесь, чтобы не пропустить к ним ни одной взятки, - говорил министр образования, забирая чемоданчик",2204686,0,5.2,2.0
-944,-88,"водобоязни, иначе в старости мы так и не поймём, зачем их заводил",2204686,0,5.5,4.0
-943,-88,"алкоголя, а так хотелось бы проводить вечер пятницы всей семьёй вместе",2204686,0,2.6,2.0
-942,-88,- неправильная формулировка. Правильная: детей нужно защищать для,2204686,0,2.2,2.0
-941,-88,"министерств здравоохранения и образования, дабы сберечь психику и креативность",5197119,0,5.8,4.0
-940,-88,"вредной информации, которая может плохо повлиять на их неокрепшие умы, - говаривал Гитлер о еврейских текстах",2204686,0,4.8,4.0
-939,-88,0:00 до 23:59 1 июня,2204686,0,3.0,2.0
-938,-88,защитников детей,18486664,1,7.5,8.0
-937,-88,других детей,18486664,0,5.0,4.0
-936,-87,"внешне все меньше в нынешние времена, отличить было трудно, - оправдывался слесарь Потапов перед столяром Ивановым",2204686,0,3.0,3.0
-935,-87,"тем, что им не по хуй",2204686,0,4.4,4.0
-934,-87,"а мужчины от женщин не отличаются! - громко доказывала Света, считавшая себя феминисткой",2204686,1,5.8,5.0
-933,-87,", а не мужчины от женщин.",18486664,0,2.2,1.0
-932,-87,и точка,18486664,0,2.6,2.0
-931,-86,обед,229385601,1,3.0,3.0
-930,-86,говно. Только проснулся — уже в говно.,11420264,0,2.625,1.0
-929,-85,может быть мы бы её ещё любили,18048224,0,3.0,3.0
-928,-85,то мой плейлист был бы только из одной песни Юрия Лозы,18048224,0,6.125,6.5
-927,-85,я бы перестал западать на старушек,18048224,0,3.0,1.0
-926,-85,Не было бы песен Максима Галкина,2204686,0,4.57143,3.0
-925,-85,"на одну мумию на ""Голубом огоньке"" было бы меньше",2204686,0,3.28571,3.0
-924,-85,", то кого звать с собой, кто придёт сквозь злые ночи?",56109258,1,6.42857,6.5
-923,-85,", Галкин не был бы ведущим на первом канале",56109258,0,4.0,3.0
-922,-85,", нельзя было бы развести парня на миллион миллион алых роз...)",56109258,0,4.25,4.0
-921,-84,До сих пор бухой,6681591,0,2.85714,2.0
-920,-84,"из лужицы Иванушка и стал инспектор гибдд старший сержант Иван Александрович, предьявите ваши документы",5197119,0,4.57143,5.0
-919,-84,....арарв аоадыдчткшв свлтаушц своей бывшей,5197119,0,3.71429,3.0
-918,-84,", закусил и зациклился",5197119,0,5.375,5.0
-917,-84,"с шуткоботом и сказала рыбка человеческим голосом: ""Человек наполовину состоит из добивки""",2204686,0,6.0,3.0
-916,-84,"1,5 литра воды и не стал здоровым. Может я не врач?",5197119,0,3.85714,2.0
-915,-84,"гиннеса - заговорил на ирландском;
выпил шпатена - заговорил на немецком;
выпил балтику 7ку - язык стал заплетаться",5197119,0,5.42857,3.0
-914,-84,"элексир бессмертия и теперь вся жизнь на игле, а яйца в утке - жаловался Кощей",2204686,1,6.57143,4.0
-913,-84,". А теперь ты расскажи, как попал в вытрезвитель?",2204686,0,3.875,4.0
-912,-84,"и ещё раз, и ещё много-много раз!",2204686,0,3.71429,3.0
-911,-84,"абсент и... Снится нам трава трава у доооома, зелеееная зелеееная трава",5197119,0,3.14286,3.0
-910,-84,- и с тех пор понеслось!,2204686,0,4.14286,3.0
-909,-84,медовуху и украл у медведя мёд,5197119,0,3.57143,2.0
-908,-84,валерьяны и мяяяяяяууууу мяу мяу мяу,5197119,0,3.85714,4.0
-907,-84,ромашковый чай и не успоколся. Опасный я.,5197119,1,5.28571,5.0
-906,-84,",как-то раз закусил",229385601,0,3.125,3.0
-904,-81,человечины,2204686,0,2.25,2.0
-903,-81,"мамы, а на вторую - из папы",2204686,0,3.0,3.0
-902,-81,половины,2204686,1,4.875,3.0
-901,-81,.,229385601,0,1.0,1.0
-900,-81,озолькоинов,229385601,1,3.125,3.0
-899,-82,надо как следует сходить в туалет вечером,229385601,0,4.375,4.0
-898,-82,"моя жена предложила завести собаку. В итоге ей досталось легче, а мне - вставать по утрам...",2204686,0,6.5,5.0
-897,-82,все перестали читать и писать в шуткобота,2204686,0,2.85714,2.0
-896,-82,я передвинул начало своего рабочего дня на 15 часов утра,2204686,0,6.28571,4.0
-895,-82,я не ложусь,2204686,1,6.85714,6.5
-894,-83,дожить до новогодних,5197119,1,3.0,2.0
-893,-83,+1 добивку,8025376,0,2.71429,1.0
-892,-80,"вывести тараканов, пока они не вывели тебя из себя",2204686,0,3.66667,1.0
-891,-80,"победа над собой"" - сказал Гитлер и выпил яду",2204686,0,5.83333,6.5
-890,-80,"выиграть 9 мая в лотерею ""Победа"" автомобиль ""Победа""",2204686,0,3.57143,1.0
-889,-80,"сжечь к хренам Москву и у меня это получилось"", - рассказывал внукам Наполеона Кутузов",2204686,0,2.6,2.0
-888,-80,победить лень. Вернее так: победить? Лень...,2204686,0,3.0,3.0
-887,-80,отвоевать себе отгулы с 6го по 8е,2204686,0,3.28571,1.0
-886,-80,радует!,2204686,0,4.0,1.0
-885,-80,"когда ты рад больше, чем тебе завидуют",2204686,0,2.8,1.0
-884,-80,просто как по щелчку пальцев,2204686,0,4.33333,3.0
-883,-80,найти лучшую шаурму в Москве,18048224,0,2.33333,2.0
-882,-80,Сделать годное селфи с 1 разв,9751803,0,2.66667,2.0
-881,-80,У Зеленского,9751803,1,7.16667,8.0
-880,-80,Когда купил Алко в 22:59,9751803,0,2.66667,2.0
-879,-79,", но мне бы хватило и одного",34957710,1,5.9,5.0
-878,-79,"- 8 и 13 за эту шутку. Как видишь, стакан еще полон",18048224,0,5.18182,4.0
-877,-79,- я добил шутку и предложил зачин,18048224,0,5.8,4.0
-876,-79,и только одна печень,18048224,0,4.27273,5.0
-875,-79,"и 100500, чтобы похавать",18048224,0,3.46154,3.0
-874,-79,- у меня есть и я хочу,18048224,0,2.75,2.0
-873,-79,1) нашёл повод 2) нашёл что бы выпить,2204686,0,2.54545,1.0
-872,-79,1) хочу 2) через нехочу,2204686,0,4.33333,4.0
-871,-79,1) хочу пить 2) надо про что-то пошутить в шуткоботе,2204686,0,3.3,3.0
-870,-79,", но про оба уже наверняка кто-то другой пошутил в шуткоботе",2204686,0,4.5,4.0
-869,-79,", работа и отдых - сказал сомелье",2204686,1,4.22222,5.0
-868,-79,- первый и второй (и перерывчик небольшой),2204686,0,3.66667,3.0
-867,-79,- стакан наполовину пуст и наполовину полон,2204686,0,4.0,3.0
-866,-79,"- с горя оттого, что денег нет и от радости, что деньги есть",2204686,0,3.44444,3.0
-865,-79,- будни и выходные,2204686,0,2.5,2.0
-864,-76,"- прежде, чем воспользоваться возможностью уделать друга в споре, попробуйте воспользоваться головой!",2204686,0,2.33333,2.0
-863,-76,- не садитесь за руль. Сидеть за столом реально удобнее!,2204686,1,4.73333,3.0
-862,-76,- будьте осторожнее. Они тоже хотят отдохнуть на праздниках!,2204686,1,4.46667,3.0
-861,-77,"""Сегодня ты можешь предложить ещё 5 добивок""",54396,0,4.83333,5.0
-860,-77,"""Герасим, это просто совпадение""",54396,0,4.27273,4.0
-859,-77,"""Давай уже после майских, старче!""",2204686,1,6.25,6.5
-858,-77,"отпущу я тебя, мужик, только ты исполни три моих желания",18486664,0,3.45455,3.0
-857,-77,"""админы в отпуске, поэтому пока шуткобот молчит, как я...""",8025376,0,2.09091,1.0
-856,-77,Такой пиздец в стране больше я молчать не могу,169738128,0,5.58333,5.0
-855,-77,Ты пидор [2],80869211,0,5.08333,3.0
-854,-77,Ты пидор,80869211,0,4.41667,2.0
-853,-77,надо платить за ипотеку,54969569,0,2.41667,1.0
-852,-78,"у всех отложить все на ""Давай уже после майских""",2204686,1,4.21429,4.0
-851,-78,жуки,2204686,0,3.28571,3.0
-850,-78,рассмешить Бога.,54396,0,3.71429,3.0
-849,-78,"Написать три добивки, чтобы можно было смотреть лучшие шутки предыдущего дня.",54396,1,5.07143,3.0
-848,-74,"рифмоплеты занимались стихами, а не бургерными и наушниками",5197119,0,3.44444,3.0
-847,-74,только Дантес был на коне.,5197119,0,2.0,2.0
-846,-74,"белочка просто грызла ядра орехов, а не приходила к каждому алкоголику по пьяни",5197119,0,3.375,3.0
-845,-74,"перчаткой можно было не только в нокаут отправить, но и убить в дальнейшем",5197119,0,4.33333,4.0
-844,-74,"реп баттлы были между крестьянами, не поделившими репу.",8025376,0,4.33333,4.0
-843,-74,бакенбарды носили не только хипстеры,5197119,0,3.8,5.0
-842,-74,"если ты захотел пошутить, то тебя в ответ могли захотеть поSHOOTить",2204686,0,3.625,4.0
-841,-74,"стреляли поэтов, а не сигареты",2204686,1,6.25,5.0
-840,-74,лайки ещё были @,2204686,0,3.44444,2.0
-839,-74,лайки ставили взасос,2204686,0,5.33333,5.0
-838,-74,"вместо ""Ок, Google!"" говорили ""Лакей, книгу!""",2204686,0,5.88889,5.0
-837,-74,"фраза ""Сегодня в Петербурге 8 баллов"" была не про пробки",2204686,0,5.0,5.0
-836,-74,стра-на пья-на до тем-на хоп-хей-на-на-на!,2204686,0,2.25,2.0
-835,-74,пора валить с такими законами,18048224,0,4.77778,3.0
-834,-74,российский интернет был в меньшей опасности,18048224,1,5.25,5.0
-833,-73,"сериал игра престолов на территории России, чтобы не подавать идеи как свергать Короля.",6681591,0,4.0,3.0
-832,-73,"геев. Милонов выступил категорически против - против того, чтобы называть геями пидоров",2204686,0,3.66667,2.0
-831,-73,адекватно мыслить. По их оценкам большинство россиян этот запрет все равно не затронет,2204686,0,4.7,5.0
-830,-73,словосочетания. Теперь законно не могут и двух слов связать.,8025376,1,5.75,6.5
-829,-73,запретный плод и человеческий род так и остановился на Адаме и Еве,5197119,0,3.0,3.0
-828,-73,запрещать и застряла в лимбе,5197119,0,4.0,3.0
-827,-73,"шуткобота, потому что не ахерели ли вы шутки про думу придумывать?",14138505,0,4.11111,3.0
-826,-72,зверей вида Homo prishol-s-detmi-v-vyhodnye,2204686,0,3.27273,2.0
-825,-72,"бесит, что обычно зоопарк это не зоопарк",18048224,0,1.6,1.0
-824,-72,"раздражает вольер с макаками, откуда меня не выпускают",18048224,1,6.0,5.0
-823,-72,"дневного персонала дети любят охранника Петровича. А ночью уже Петрович любит того, кто больше любил его.",18048224,0,2.8,3.0
-822,-72,Серсея любит смотреть на слонов,18048224,0,2.33333,1.0
-821,-72,"букв ""о""",2204686,0,3.54545,3.0
-820,-71,не очень,18486664,0,2.33333,1.0
-819,-71,"трудно: Джек Ма, Джек Па, Джек Ба и Джек Де оказались не одной семьёй. И даже не однофамильцами...",2204686,0,3.54545,2.0
-818,-71,просто от европейцев,2204686,0,4.7,4.0
-817,-71,не очень...,2204686,0,4.08333,3.0
-816,-71,лёгкий отличительный большой разница отличная качество  xiaomi Huawei iPhone различение человек сортировка,2204686,1,8.90909,8.0
-815,-71,"просто. Вот ты попробуй ""одень"" от ""надень"" отличить!",2204686,0,3.18182,3.0
-814,-71,"Просто, азиат это азиат, остальные не азиат",101948008,0,3.83333,3.0
-813,-71,"Азиат уже пьян, в то время как Русский пьет 25 стакан",101948008,0,2.09091,1.0
-812,-71,"Просто, Азиат уже закончил собирать мебель из Икеи, в то время пока Русские поняли что акул больше нет и идут открывать коробку из под мебели",101948008,0,1.88889,1.0
-811,-70,"- ""вжух и ты вне очереди"" за акцией уже скопилась очередь",5197119,0,4.6875,4.0
-810,-70,- Депозит с отрицательной ставкой. Поможем инфляции!,5197119,0,4.46667,4.0
-809,-70,"- ""Где получали там уже нету""",5197119,0,5.0625,3.0
-808,-70,Татуировка с котом Грефа даёт ипотеку без взноса,5197119,0,5.0625,3.0
-807,-70,"agile процент по кредиту от Грефа - то 20, то 30%",5197119,0,3.07143,3.0
-806,-70,Две бабушки в очереди по цене одной,5197119,0,3.66667,3.0
-805,-70,"""Сберегаем нервы"": все ваши нервы потраченные в отделении вернуться в виде кешбека нервами при общении с колл-центром",2204686,1,5.5,5.0
-804,-70,"""Оплата без комиссии"": теперь чтобы что-то оплатить не нужно показывать свой платёж комиссии по одобрению платежей в своём отделении",2204686,0,4.85714,3.0
